{
 "operation_type": "RECEIVE",
 "site_id": 1,
 "source_document": {
  "source_ref": "sha256:deadbeef",
  "source_document_type": "ocr_scan",
  "source_document_date": "2026-08-03",
  "number": "154",
  "date": "03.08.2026",
  "supplier": "ООО «Стройресурс»"
 },
 "lines": [
  {
   "line_number": 1,
   "item_id": 10,
   "qty": 5,
   "raw_name": "Подшипник 6205",
   "raw_unit": "шт"
  },
  {
   "line_number": 2,
   "item_id": null,
   "qty": 4,
   "raw_name": "Шланг кислородный",
   "raw_unit": "м"
  }
 ]
}